{
  "$schema": "../../schemas/asset-v1.schema.json",
  "schema_version": 1,
  "id": "amiga-ocs-generation-reference-03",
  "title": "Amiga OCS generation reference 03",
  "description": "Historical foreground style reference from which reference 04 was developed.",
  "file": {"path": "source.png", "media_type": "image/png", "bytes": 2111427, "sha256": "6d4dbdd6d031678d83468122d6b8201266b5e2f3272f8628ebfd3af0dd871823", "dimensions": {"width": 1254, "height": 1254}},
  "provenance": {"kind": "generated", "status": "incomplete", "original_filename": "generation-reference-03.png", "notes": "Historical generated reference. The original generator, model, prompt, parameters, and creation time were not retained."},
  "rights": {"status": "unknown", "review_required": true, "notes": "The historical record does not contain an explicit rights determination."},
  "adoption": {"adopted_at": "2026-08-11T00:00:00Z", "from_path": "tools/cards/assets/amiga-ocs-portrait-v1/generation-reference-03.png"}
}
