{
  "$schema": "../../schemas/asset-v1.schema.json",
  "schema_version": 1,
  "id": "estate-card-armoured-reference",
  "title": "Estate card armoured portrait reference",
  "description": "Bundled armoured claimant portrait used to seed new workbench reference catalogs.",
  "file": {"path": "source.png", "media_type": "image/png", "bytes": 2115883, "sha256": "41af4a9b256720e223f29ed92f28b65eb170be6794657cadf91c2f0701356673", "dimensions": {"width": 1024, "height": 1536}},
  "provenance": {"kind": "unknown", "status": "unknown", "original_filename": "eba013818158.png", "notes": "Retained from the historical portrait-review style assets; no original provider, creator, prompt, or source URL is recorded."},
  "rights": {"status": "unknown", "review_required": true, "notes": "The historical record does not contain an explicit rights determination."},
  "adoption": {"adopted_at": "2026-08-11T00:00:00Z", "from_path": "tools/portraits/assets/estate-card-v1/eba013818158.png"}
}
