{
  "$schema": "../../schemas/asset-v1.schema.json",
  "schema_version": 1,
  "id": "estate-card-firelit-reference",
  "title": "Estate card firelit portrait reference",
  "description": "Bundled firelit hooded portrait used to seed new workbench reference catalogs.",
  "file": {"path": "source.png", "media_type": "image/png", "bytes": 1843476, "sha256": "fe3336680a7a39cf921237163897fe99d5651c472ea899a2fc1da0d0569ce264", "dimensions": {"width": 1024, "height": 1536}},
  "provenance": {"kind": "unknown", "status": "unknown", "original_filename": "9ff3c44f945f.png", "notes": "Retained from the historical portrait-review style assets; no original provider, creator, prompt, or source URL is recorded."},
  "rights": {"status": "unknown", "review_required": true, "notes": "The historical record does not contain an explicit rights determination."},
  "adoption": {"adopted_at": "2026-08-11T00:00:00Z", "from_path": "tools/portraits/assets/estate-card-v1/9ff3c44f945f.png"}
}
